{
  "artifact": "tools/t44_storage_source.json",
  "artifact_file_sha256": "74a23c481027dd808d87a8dd2031d86ec10865e3c3efa974016f1bf15c51a402",
  "builder_sha256": "2a8958d42a5489f39cfa0d9cca8b3939daea93587999ebe735894e5ccdb403d8",
  "dependency_semantic_roots": {},
  "envelope_sha256": "728977d31c7ae02851bb45029face195877231779f44ac53b6945eae70169656",
  "generated_by": "python tools/currentness.py",
  "giant_body": false,
  "schema_version": 2,
  "semantic_projection_kind": "json_ledger",
  "semantic_projection_version": 1,
  "semantic_root_sha256": "6e30f2b6c51fc296f440485731c28e7000374188735f3937c3123f2ffe46a918",
  "source_replay_receipt": {
    "proof_tier": "compact",
    "status": "unavailable"
  },
  "status": "CURRENTNESS_SIDECAR"
}
