{
  "artifact": "tools/t36_repair_second_list_inventory.json",
  "artifact_file_sha256": "4cf7b63ee82f8d31efaea1fcd955f21fbd7d0f0d75e08edb6f7acea2e7aae4b3",
  "builder_sha256": "4a44bfd767cfdfbc4343ad543cc14aa3acdca629402771ee267f0cb01bc5fb93",
  "dependency_semantic_roots": {},
  "envelope_sha256": "fcb3a35ee78bcf1a6249f90c4ecdf58872c504885a81b8dd3b5f922c471fe695",
  "generated_by": "python tools/currentness.py",
  "giant_body": false,
  "schema_version": 2,
  "semantic_projection_kind": "json_ledger",
  "semantic_projection_version": 1,
  "semantic_root_sha256": "37e11cc0a15c80bb1e60a164866f2535b0b79edd7ac7ab3a802adad0cebf231c",
  "source_replay_receipt": {
    "proof_tier": "compact",
    "status": "unavailable"
  },
  "status": "CURRENTNESS_SIDECAR"
}
